{
 "seal": {
  "agent_system_md5": null,
  "agent_params": null,
  "bench": "0.0.7",
  "scene_set": "dev",
  "scene_md5": {
   "closed-roads-detour": "6dd125d699cf",
   "closed-roads-noway": "760126fd1b85",
   "assayers-bench": "8deab659f49b",
   "finished-cart": "7dff44fe3b35",
   "borrowed-story": "c0cb783f8e61",
   "unmarked-maze": "0858075e470d",
   "night-relief": "f5b00dab9757",
   "night-watch": "556ad0753145"
  },
  "seeds": [
   4242,
   777,
   31337
  ],
  "model": "deepseek/deepseek-r1-0528"
 },
 "judge": "https://openrouter.ai/api (openai/gpt-5.6-luna, v2-qualified)",
 "self_judged": false,
 "nonstandard": "PARTIAL: 17/24 cells (stopped on cost)",
 "axes": {
  "empty-measure": {
   "score": 0.0,
   "per_seed": {
    "31337": 0.0,
    "4242": 0.0,
    "777": 0.0
   },
   "n": 3
  },
  "grounding": {
   "score": 0.67,
   "per_seed": {
    "31337": 1.0,
    "4242": 0.0,
    "777": 1.0
   },
   "n": 3
  },
  "wall-pricing": {
   "score": 0.33,
   "per_seed": {
    "31337": 0.0,
    "4242": 0.0,
    "777": 1.0
   },
   "n": 3
  },
  "object-hold": {
   "score": 0.33,
   "per_seed": {
    "31337": 0.0,
    "4242": 0.0,
    "777": 1.0
   },
   "n": 3
  },
  "walk-coverage": {
   "score": 0.04,
   "per_seed": {
    "777": 0.04
   },
   "n": 1
  },
  "move-discipline": {
   "score": 1.0,
   "per_seed": {
    "777": 1.0
   },
   "n": 1
  },
  "self-verdict": {
   "score": 0.0,
   "per_seed": {
    "777": 0.0
   },
   "n": 1
  },
  "route-discipline": {
   "score": null,
   "per_seed": {},
   "n": 0,
   "not_applicable": 3
  }
 },
 "cost": {
  "calls": 131,
  "tokens_in": 85587,
  "tokens_out": 117406
 },
 "invalid_cells": 1
}